Frame 1: 101 bytes on wire (808 bits), 101 bytes captured (808 bits)
    Encapsulation type: Ethernet (1)
    Arrival Time: Dec  1, 2019 23:15:36.449643000 EST
    [Time shift for this packet: 0.000000000 seconds]
    Epoch Time: 1575260136.449643000 seconds
    [Time delta from previous captured frame: 0.000000000 seconds]
    [Time delta from previous displayed frame: 0.000000000 seconds]
    [Time since reference or first frame: 0.000000000 seconds]
    Frame Number: 1
    Frame Length: 101 bytes (808 bits)
    Capture Length: 101 bytes (808 bits)
    [Frame is marked: False]
    [Frame is ignored: False]
    [Protocols in frame: eth:ethertype:ip:udp:mdns]
Ethernet II, Src: Apple_50:83:ed (78:4f:43:50:83:ed), Dst: IPv4mcast_fb (01:00:5e:00:00:fb)
    Destination: IPv4mcast_fb (01:00:5e:00:00:fb)
        Address: IPv4mcast_fb (01:00:5e:00:00:fb)
        .... ..0. .... .... .... .... = LG bit: Globally unique address (factory default)
        .... ...1 .... .... .... .... = IG bit: Group address (multicast/broadcast)
    Source: Apple_50:83:ed (78:4f:43:50:83:ed)
        Address: Apple_50:83:ed (78:4f:43:50:83:ed)
        .... ..0. .... .... .... .... = LG bit: Globally unique address (factory default)
        .... ...0 .... .... .... .... = IG bit: Individual address (unicast)
    Type: IPv4 (0x0800)
Internet Protocol Version 4, Src: 172.30.2.254, Dst: 224.0.0.251
    0100 .... = Version: 4
    .... 0101 = Header Length: 20 bytes (5)
    Differentiated Services Field: 0x00 (DSCP: CS0, ECN: Not-ECT)
        0000 00.. = Differentiated Services Codepoint: Default (0)
        .... ..00 = Explicit Congestion Notification: Not ECN-Capable Transport (0)
    Total Length: 87
    Identification: 0x4039 (16441)
    Flags: 0x0000
        0... .... .... .... = Reserved bit: Not set
        .0.. .... .... .... = Don't fragment: Not set
        ..0. .... .... .... = More fragments: Not set
        ...0 0000 0000 0000 = Fragment offset: 0
    Time to live: 255
    Protocol: UDP (17)
    Header checksum: 0xeb44 [validation disabled]
    [Header checksum status: Unverified]
    Source: 172.30.2.254
    Destination: 224.0.0.251
User Datagram Protocol, Src Port: 5353, Dst Port: 5353
    Source Port: 5353
    Destination Port: 5353
    Length: 67
    Checksum: 0xfb07 [unverified]
    [Checksum Status: Unverified]
    [Stream index: 0]
    [Timestamps]
        [Time since first frame: 0.000000000 seconds]
        [Time since previous frame: 0.000000000 seconds]
Multicast Domain Name System (response)
    Transaction ID: 0x0000
    Flags: 0x8400 Standard query response, No error
        1... .... .... .... = Response: Message is a response
        .000 0... .... .... = Opcode: Standard query (0)
        .... .1.. .... .... = Authoritative: Server is an authority for domain
        .... ..0. .... .... = Truncated: Message is not truncated
        .... ...0 .... .... = Recursion desired: Don't do query recursively
        .... .... 0... .... = Recursion available: Server can't do recursive queries
        .... .... .0.. .... = Z: reserved (0)
        .... .... ..0. .... = Answer authenticated: Answer/authority portion was not authenticated by the server
        .... .... ...0 .... = Non-authenticated data: Unacceptable
        .... .... .... 0000 = Reply code: No error (0)
    Questions: 0
    Answer RRs: 1
    Authority RRs: 0
    Additional RRs: 0
    Answers
        mjh-wireless-concordia-ca.local: type A, class IN, cache flush, addr 172.30.2.254
            Name: mjh-wireless-concordia-ca.local
            Type: A (Host Address) (1)
            .000 0000 0000 0001 = Class: IN (0x0001)
            1... .... .... .... = Cache flush: True
            Time to live: 10
            Data length: 4
            Address: 172.30.2.254
    [Unsolicited: True]

0000  01 00 5e 00 00 fb 78 4f 43 50 83 ed 08 00 45 00   ..^...xOCP....E.
0010  00 57 40 39 00 00 ff 11 eb 44 ac 1e 02 fe e0 00   .W@9.....D......
0020  00 fb 14 e9 14 e9 00 43 fb 07 00 00 84 00 00 00   .......C........
0030  00 01 00 00 00 00 19 6d 6a 68 2d 77 69 72 65 6c   .......mjh-wirel
0040  65 73 73 2d 63 6f 6e 63 6f 72 64 69 61 2d 63 61   ess-concordia-ca
0050  05 6c 6f 63 61 6c 00 00 01 80 01 00 00 00 0a 00   .local..........
0060  04 ac 1e 02 fe                                    .....

Frame 2: 93 bytes on wire (744 bits), 93 bytes captured (744 bits)
    Encapsulation type: Ethernet (1)
    Arrival Time: Dec  1, 2019 23:15:37.805835000 EST
    [Time shift for this packet: 0.000000000 seconds]
    Epoch Time: 1575260137.805835000 seconds
    [Time delta from previous captured frame: 1.356192000 seconds]
    [Time delta from previous displayed frame: 1.356192000 seconds]
    [Time since reference or first frame: 1.356192000 seconds]
    Frame Number: 2
    Frame Length: 93 bytes (744 bits)
    Capture Length: 93 bytes (744 bits)
    [Frame is marked: False]
    [Frame is ignored: False]
    [Protocols in frame: eth:ethertype:ip:tcp:tls]
Ethernet II, Src: Apple_50:83:ed (78:4f:43:50:83:ed), Dst: Cisco_52:9e:80 (00:0a:f3:52:9e:80)
    Destination: Cisco_52:9e:80 (00:0a:f3:52:9e:80)
        Address: Cisco_52:9e:80 (00:0a:f3:52:9e:80)
        .... ..0. .... .... .... .... = LG bit: Globally unique address (factory default)
        .... ...0 .... .... .... .... = IG bit: Individual address (unicast)
    Source: Apple_50:83:ed (78:4f:43:50:83:ed)
        Address: Apple_50:83:ed (78:4f:43:50:83:ed)
        .... ..0. .... .... .... .... = LG bit: Globally unique address (factory default)
        .... ...0 .... .... .... .... = IG bit: Individual address (unicast)
    Type: IPv4 (0x0800)
Internet Protocol Version 4, Src: 172.30.2.254, Dst: 172.217.13.163
    0100 .... = Version: 4
    .... 0101 = Header Length: 20 bytes (5)
    Differentiated Services Field: 0x02 (DSCP: CS0, ECN: ECT(0))
        0000 00.. = Differentiated Services Codepoint: Default (0)
        .... ..10 = Explicit Congestion Notification: ECN-Capable Transport codepoint '10' (2)
    Total Length: 79
    Identification: 0x0000 (0)
    Flags: 0x4000, Don't fragment
        0... .... .... .... = Reserved bit: Not set
        .1.. .... .... .... = Don't fragment: Set
        ..0. .... .... .... = More fragments: Not set
        ...0 0000 0000 0000 = Fragment offset: 0
    Time to live: 64
    Protocol: TCP (6)
    Header checksum: 0xd10e [validation disabled]
    [Header checksum status: Unverified]
    Source: 172.30.2.254
    Destination: 172.217.13.163
Transmission Control Protocol, Src Port: 51605, Dst Port: 443, Seq: 1, Ack: 1, Len: 39
    Source Port: 51605
    Destination Port: 443
    [Stream index: 0]
    [TCP Segment Len: 39]
    Sequence number: 1    (relative sequence number)
    [Next sequence number: 40    (relative sequence number)]
    Acknowledgment number: 1    (relative ack number)
    0101 .... = Header Length: 20 bytes (5)
    Flags: 0x018 (PSH, ACK)
        000. .... .... = Reserved: Not set
        ...0 .... .... = Nonce: Not set
        .... 0... .... = Congestion Window Reduced (CWR): Not set
        .... .0.. .... = ECN-Echo: Not set
        .... ..0. .... = Urgent: Not set
        .... ...1 .... = Acknowledgment: Set
        .... .... 1... = Push: Set
        .... .... .0.. = Reset: Not set
        .... .... ..0. = Syn: Not set
        .... .... ...0 = Fin: Not set
        [TCP Flags: ·······AP···]
    Window size value: 65535
    [Calculated window size: 65535]
    [Window size scaling factor: -1 (unknown)]
    Checksum: 0xed32 [unverified]
    [Checksum Status: Unverified]
    Urgent pointer: 0
    [SEQ/ACK analysis]
        [Bytes in flight: 39]
        [Bytes sent since last PSH flag: 39]
    [Timestamps]
        [Time since first frame in this TCP stream: 0.000000000 seconds]
        [Time since previous frame in this TCP stream: 0.000000000 seconds]
    TCP payload (39 bytes)
Transport Layer Security
    TLSv1.2 Record Layer: Application Data Protocol: http-over-tls
        Content Type: Application Data (23)
        Version: TLS 1.2 (0x0303)
        Length: 34
        Encrypted Application Data: ebf6be3726ecbc572757ab5f423d5cac3d46de5d5a436d95…

0000  00 0a f3 52 9e 80 78 4f 43 50 83 ed 08 00 45 02   ...R..xOCP....E.
0010  00 4f 00 00 40 00 40 06 d1 0e ac 1e 02 fe ac d9   .O..@.@.........
0020  0d a3 c9 95 01 bb e2 ac 10 b5 9e 85 2d 71 50 18   ............-qP.
0030  ff ff ed 32 00 00 17 03 03 00 22 eb f6 be 37 26   ...2......"...7&
0040  ec bc 57 27 57 ab 5f 42 3d 5c ac 3d 46 de 5d 5a   ..W'W._B=\.=F.]Z
0050  43 6d 95 3e f2 1f 5e 44 0b 63 91 45 15            Cm.>..^D.c.E.

Frame 3: 54 bytes on wire (432 bits), 54 bytes captured (432 bits)
    Encapsulation type: Ethernet (1)
    Arrival Time: Dec  1, 2019 23:15:37.813133000 EST
    [Time shift for this packet: 0.000000000 seconds]
    Epoch Time: 1575260137.813133000 seconds
    [Time delta from previous captured frame: 0.007298000 seconds]
    [Time delta from previous displayed frame: 0.007298000 seconds]
    [Time since reference or first frame: 1.363490000 seconds]
    Frame Number: 3
    Frame Length: 54 bytes (432 bits)
    Capture Length: 54 bytes (432 bits)
    [Frame is marked: False]
    [Frame is ignored: False]
    [Protocols in frame: eth:ethertype:ip:tcp]
Ethernet II, Src: Cisco_52:9e:80 (00:0a:f3:52:9e:80), Dst: Apple_50:83:ed (78:4f:43:50:83:ed)
    Destination: Apple_50:83:ed (78:4f:43:50:83:ed)
        Address: Apple_50:83:ed (78:4f:43:50:83:ed)
        .... ..0. .... .... .... .... = LG bit: Globally unique address (factory default)
        .... ...0 .... .... .... .... = IG bit: Individual address (unicast)
    Source: Cisco_52:9e:80 (00:0a:f3:52:9e:80)
        Address: Cisco_52:9e:80 (00:0a:f3:52:9e:80)
        .... ..0. .... .... .... .... = LG bit: Globally unique address (factory default)
        .... ...0 .... .... .... .... = IG bit: Individual address (unicast)
    Type: IPv4 (0x0800)
Internet Protocol Version 4, Src: 172.217.13.163, Dst: 172.30.2.254
    0100 .... = Version: 4
    .... 0101 = Header Length: 20 bytes (5)
    Differentiated Services Field: 0x00 (DSCP: CS0, ECN: Not-ECT)
        0000 00.. = Differentiated Services Codepoint: Default (0)
        .... ..00 = Explicit Congestion Notification: Not ECN-Capable Transport (0)
    Total Length: 40
    Identification: 0x5e5c (24156)
    Flags: 0x4000, Don't fragment
        0... .... .... .... = Reserved bit: Not set
        .1.. .... .... .... = Don't fragment: Set
        ..0. .... .... .... = More fragments: Not set
        ...0 0000 0000 0000 = Fragment offset: 0
    Time to live: 61
    Protocol: TCP (6)
    Header checksum: 0x75db [validation disabled]
    [Header checksum status: Unverified]
    Source: 172.217.13.163
    Destination: 172.30.2.254
Transmission Control Protocol, Src Port: 443, Dst Port: 51605, Seq: 1, Ack: 40, Len: 0
    Source Port: 443
    Destination Port: 51605
    [Stream index: 0]
    [TCP Segment Len: 0]
    Sequence number: 1    (relative sequence number)
    [Next sequence number: 1    (relative sequence number)]
    Acknowledgment number: 40    (relative ack number)
    0101 .... = Header Length: 20 bytes (5)
    Flags: 0x010 (ACK)
        000. .... .... = Reserved: Not set
        ...0 .... .... = Nonce: Not set
        .... 0... .... = Congestion Window Reduced (CWR): Not set
        .... .0.. .... = ECN-Echo: Not set
        .... ..0. .... = Urgent: Not set
        .... ...1 .... = Acknowledgment: Set
        .... .... 0... = Push: Not set
        .... .... .0.. = Reset: Not set
        .... .... ..0. = Syn: Not set
        .... .... ...0 = Fin: Not set
        [TCP Flags: ·······A····]
    Window size value: 19561
    [Calculated window size: 19561]
    [Window size scaling factor: -1 (unknown)]
    Checksum: 0x6f02 [unverified]
    [Checksum Status: Unverified]
    Urgent pointer: 0
    [SEQ/ACK analysis]
        [This is an ACK to the segment in frame: 2]
        [The RTT to ACK the segment was: 0.007298000 seconds]
    [Timestamps]
        [Time since first frame in this TCP stream: 0.007298000 seconds]
        [Time since previous frame in this TCP stream: 0.007298000 seconds]

0000  78 4f 43 50 83 ed 00 0a f3 52 9e 80 08 00 45 00   xOCP.....R....E.
0010  00 28 5e 5c 40 00 3d 06 75 db ac d9 0d a3 ac 1e   .(^\@.=.u.......
0020  02 fe 01 bb c9 95 9e 85 2d 71 e2 ac 10 dc 50 10   ........-q....P.
0030  4c 69 6f 02 00 00                                 Lio...

Frame 4: 93 bytes on wire (744 bits), 93 bytes captured (744 bits)
    Encapsulation type: Ethernet (1)
    Arrival Time: Dec  1, 2019 23:15:37.813737000 EST
    [Time shift for this packet: 0.000000000 seconds]
    Epoch Time: 1575260137.813737000 seconds
    [Time delta from previous captured frame: 0.000604000 seconds]
    [Time delta from previous displayed frame: 0.000604000 seconds]
    [Time since reference or first frame: 1.364094000 seconds]
    Frame Number: 4
    Frame Length: 93 bytes (744 bits)
    Capture Length: 93 bytes (744 bits)
    [Frame is marked: False]
    [Frame is ignored: False]
    [Protocols in frame: eth:ethertype:ip:tcp:tls]
Ethernet II, Src: Cisco_52:9e:80 (00:0a:f3:52:9e:80), Dst: Apple_50:83:ed (78:4f:43:50:83:ed)
    Destination: Apple_50:83:ed (78:4f:43:50:83:ed)
        Address: Apple_50:83:ed (78:4f:43:50:83:ed)
        .... ..0. .... .... .... .... = LG bit: Globally unique address (factory default)
        .... ...0 .... .... .... .... = IG bit: Individual address (unicast)
    Source: Cisco_52:9e:80 (00:0a:f3:52:9e:80)
        Address: Cisco_52:9e:80 (00:0a:f3:52:9e:80)
        .... ..0. .... .... .... .... = LG bit: Globally unique address (factory default)
        .... ...0 .... .... .... .... = IG bit: Individual address (unicast)
    Type: IPv4 (0x0800)
Internet Protocol Version 4, Src: 172.217.13.163, Dst: 172.30.2.254
    0100 .... = Version: 4
    .... 0101 = Header Length: 20 bytes (5)
    Differentiated Services Field: 0x02 (DSCP: CS0, ECN: ECT(0))
        0000 00.. = Differentiated Services Codepoint: Default (0)
        .... ..10 = Explicit Congestion Notification: ECN-Capable Transport codepoint '10' (2)
    Total Length: 79
    Identification: 0x5e5d (24157)
    Flags: 0x4000, Don't fragment
        0... .... .... .... = Reserved bit: Not set
        .1.. .... .... .... = Don't fragment: Set
        ..0. .... .... .... = More fragments: Not set
        ...0 0000 0000 0000 = Fragment offset: 0
    Time to live: 61
    Protocol: TCP (6)
    Header checksum: 0x75b1 [validation disabled]
    [Header checksum status: Unverified]
    Source: 172.217.13.163
    Destination: 172.30.2.254
Transmission Control Protocol, Src Port: 443, Dst Port: 51605, Seq: 1, Ack: 40, Len: 39
    Source Port: 443
    Destination Port: 51605
    [Stream index: 0]
    [TCP Segment Len: 39]
    Sequence number: 1    (relative sequence number)
    [Next sequence number: 40    (relative sequence number)]
    Acknowledgment number: 40    (relative ack number)
    0101 .... = Header Length: 20 bytes (5)
    Flags: 0x018 (PSH, ACK)
        000. .... .... = Reserved: Not set
        ...0 .... .... = Nonce: Not set
        .... 0... .... = Congestion Window Reduced (CWR): Not set
        .... .0.. .... = ECN-Echo: Not set
        .... ..0. .... = Urgent: Not set
        .... ...1 .... = Acknowledgment: Set
        .... .... 1... = Push: Set
        .... .... .0.. = Reset: Not set
        .... .... ..0. = Syn: Not set
        .... .... ...0 = Fin: Not set
        [TCP Flags: ·······AP···]
    Window size value: 19561
    [Calculated window size: 19561]
    [Window size scaling factor: -1 (unknown)]
    Checksum: 0xef45 [unverified]
    [Checksum Status: Unverified]
    Urgent pointer: 0
    [SEQ/ACK analysis]
        [Bytes in flight: 39]
        [Bytes sent since last PSH flag: 39]
    [Timestamps]
        [Time since first frame in this TCP stream: 0.007902000 seconds]
        [Time since previous frame in this TCP stream: 0.000604000 seconds]
    TCP payload (39 bytes)
Transport Layer Security
    TLSv1.2 Record Layer: Application Data Protocol: http-over-tls
        Content Type: Application Data (23)
        Version: TLS 1.2 (0x0303)
        Length: 34
        Encrypted Application Data: b673ecad525064ddddec109ea5048994486311af5b8443fa…

0000  78 4f 43 50 83 ed 00 0a f3 52 9e 80 08 00 45 02   xOCP.....R....E.
0010  00 4f 5e 5d 40 00 3d 06 75 b1 ac d9 0d a3 ac 1e   .O^]@.=.u.......
0020  02 fe 01 bb c9 95 9e 85 2d 71 e2 ac 10 dc 50 18   ........-q....P.
0030  4c 69 ef 45 00 00 17 03 03 00 22 b6 73 ec ad 52   Li.E......".s..R
0040  50 64 dd dd ec 10 9e a5 04 89 94 48 63 11 af 5b   Pd.........Hc..[
0050  84 43 fa f3 d1 c1 83 b4 5f 12 4e 9d 3b            .C......_.N.;

Frame 5: 54 bytes on wire (432 bits), 54 bytes captured (432 bits)
    Encapsulation type: Ethernet (1)
    Arrival Time: Dec  1, 2019 23:15:37.813868000 EST
    [Time shift for this packet: 0.000000000 seconds]
    Epoch Time: 1575260137.813868000 seconds
    [Time delta from previous captured frame: 0.000131000 seconds]
    [Time delta from previous displayed frame: 0.000131000 seconds]
    [Time since reference or first frame: 1.364225000 seconds]
    Frame Number: 5
    Frame Length: 54 bytes (432 bits)
    Capture Length: 54 bytes (432 bits)
    [Frame is marked: False]
    [Frame is ignored: False]
    [Protocols in frame: eth:ethertype:ip:tcp]
Ethernet II, Src: Apple_50:83:ed (78:4f:43:50:83:ed), Dst: Cisco_52:9e:80 (00:0a:f3:52:9e:80)
    Destination: Cisco_52:9e:80 (00:0a:f3:52:9e:80)
        Address: Cisco_52:9e:80 (00:0a:f3:52:9e:80)
        .... ..0. .... .... .... .... = LG bit: Globally unique address (factory default)
        .... ...0 .... .... .... .... = IG bit: Individual address (unicast)
    Source: Apple_50:83:ed (78:4f:43:50:83:ed)
        Address: Apple_50:83:ed (78:4f:43:50:83:ed)
        .... ..0. .... .... .... .... = LG bit: Globally unique address (factory default)
        .... ...0 .... .... .... .... = IG bit: Individual address (unicast)
    Type: IPv4 (0x0800)
Internet Protocol Version 4, Src: 172.30.2.254, Dst: 172.217.13.163
    0100 .... = Version: 4
    .... 0101 = Header Length: 20 bytes (5)
    Differentiated Services Field: 0x00 (DSCP: CS0, ECN: Not-ECT)
        0000 00.. = Differentiated Services Codepoint: Default (0)
        .... ..00 = Explicit Congestion Notification: Not ECN-Capable Transport (0)
    Total Length: 40
    Identification: 0x0000 (0)
    Flags: 0x4000, Don't fragment
        0... .... .... .... = Reserved bit: Not set
        .1.. .... .... .... = Don't fragment: Set
        ..0. .... .... .... = More fragments: Not set
        ...0 0000 0000 0000 = Fragment offset: 0
    Time to live: 64
    Protocol: TCP (6)
    Header checksum: 0xd137 [validation disabled]
    [Header checksum status: Unverified]
    Source: 172.30.2.254
    Destination: 172.217.13.163
Transmission Control Protocol, Src Port: 51605, Dst Port: 443, Seq: 40, Ack: 40, Len: 0
    Source Port: 51605
    Destination Port: 443
    [Stream index: 0]
    [TCP Segment Len: 0]
    Sequence number: 40    (relative sequence number)
    [Next sequence number: 40    (relative sequence number)]
    Acknowledgment number: 40    (relative ack number)
    0101 .... = Header Length: 20 bytes (5)
    Flags: 0x010 (ACK)
        000. .... .... = Reserved: Not set
        ...0 .... .... = Nonce: Not set
        .... 0... .... = Congestion Window Reduced (CWR): Not set
        .... .0.. .... = ECN-Echo: Not set
        .... ..0. .... = Urgent: Not set
        .... ...1 .... = Acknowledgment: Set
        .... .... 0... = Push: Not set
        .... .... .0.. = Reset: Not set
        .... .... ..0. = Syn: Not set
        .... .... ...0 = Fin: Not set
        [TCP Flags: ·······A····]
    Window size value: 65535
    [Calculated window size: 65535]
    [Window size scaling factor: -1 (unknown)]
    Checksum: 0xbb44 [unverified]
    [Checksum Status: Unverified]
    Urgent pointer: 0
    [SEQ/ACK analysis]
        [This is an ACK to the segment in frame: 4]
        [The RTT to ACK the segment was: 0.000131000 seconds]
    [Timestamps]
        [Time since first frame in this TCP stream: 0.008033000 seconds]
        [Time since previous frame in this TCP stream: 0.000131000 seconds]

0000  00 0a f3 52 9e 80 78 4f 43 50 83 ed 08 00 45 00   ...R..xOCP....E.
0010  00 28 00 00 40 00 40 06 d1 37 ac 1e 02 fe ac d9   .(..@.@..7......
0020  0d a3 c9 95 01 bb e2 ac 10 dc 9e 85 2d 98 50 10   ............-.P.
0030  ff ff bb 44 00 00                                 ...D..

Frame 6: 118 bytes on wire (944 bits), 118 bytes captured (944 bits)
    Encapsulation type: Ethernet (1)
    Arrival Time: Dec  1, 2019 23:15:39.280418000 EST
    [Time shift for this packet: 0.000000000 seconds]
    Epoch Time: 1575260139.280418000 seconds
    [Time delta from previous captured frame: 1.466550000 seconds]
    [Time delta from previous displayed frame: 1.466550000 seconds]
    [Time since reference or first frame: 2.830775000 seconds]
    Frame Number: 6
    Frame Length: 118 bytes (944 bits)
    Capture Length: 118 bytes (944 bits)
    [Frame is marked: False]
    [Frame is ignored: False]
    [Protocols in frame: eth:ethertype:ip:tcp:tls]
Ethernet II, Src: Apple_50:83:ed (78:4f:43:50:83:ed), Dst: Cisco_52:9e:80 (00:0a:f3:52:9e:80)
    Destination: Cisco_52:9e:80 (00:0a:f3:52:9e:80)
        Address: Cisco_52:9e:80 (00:0a:f3:52:9e:80)
        .... ..0. .... .... .... .... = LG bit: Globally unique address (factory default)
        .... ...0 .... .... .... .... = IG bit: Individual address (unicast)
    Source: Apple_50:83:ed (78:4f:43:50:83:ed)
        Address: Apple_50:83:ed (78:4f:43:50:83:ed)
        .... ..0. .... .... .... .... = LG bit: Globally unique address (factory default)
        .... ...0 .... .... .... .... = IG bit: Individual address (unicast)
    Type: IPv4 (0x0800)
Internet Protocol Version 4, Src: 172.30.2.254, Dst: 18.211.118.21
    0100 .... = Version: 4
    .... 0101 = Header Length: 20 bytes (5)
    Differentiated Services Field: 0x02 (DSCP: CS0, ECN: ECT(0))
        0000 00.. = Differentiated Services Codepoint: Default (0)
        .... ..10 = Explicit Congestion Notification: ECN-Capable Transport codepoint '10' (2)
    Total Length: 104
    Identification: 0x0000 (0)
    Flags: 0x4000, Don't fragment
        0... .... .... .... = Reserved bit: Not set
        .1.. .... .... .... = Don't fragment: Set
        ..0. .... .... .... = More fragments: Not set
        ...0 0000 0000 0000 = Fragment offset: 0
    Time to live: 64
    Protocol: TCP (6)
    Header checksum: 0x028a [validation disabled]
    [Header checksum status: Unverified]
    Source: 172.30.2.254
    Destination: 18.211.118.21
Transmission Control Protocol, Src Port: 53104, Dst Port: 443, Seq: 1, Ack: 1, Len: 64
    Source Port: 53104
    Destination Port: 443
    [Stream index: 1]
    [TCP Segment Len: 64]
    Sequence number: 1    (relative sequence number)
    [Next sequence number: 65    (relative sequence number)]
    Acknowledgment number: 1    (relative ack number)
    0101 .... = Header Length: 20 bytes (5)
    Flags: 0x018 (PSH, ACK)
        000. .... .... = Reserved: Not set
        ...0 .... .... = Nonce: Not set
        .... 0... .... = Congestion Window Reduced (CWR): Not set
        .... .0.. .... = ECN-Echo: Not set
        .... ..0. .... = Urgent: Not set
        .... ...1 .... = Acknowledgment: Set
        .... .... 1... = Push: Set
        .... .... .0.. = Reset: Not set
        .... .... ..0. = Syn: Not set
        .... .... ...0 = Fin: Not set
        [TCP Flags: ·······AP···]
    Window size value: 65535
    [Calculated window size: 65535]
    [Window size scaling factor: -1 (unknown)]
    Checksum: 0x1df1 [unverified]
    [Checksum Status: Unverified]
    Urgent pointer: 0
    [SEQ/ACK analysis]
        [Bytes in flight: 64]
        [Bytes sent since last PSH flag: 64]
    [Timestamps]
        [Time since first frame in this TCP stream: 0.000000000 seconds]
        [Time since previous frame in this TCP stream: 0.000000000 seconds]
    TCP payload (64 bytes)
Transport Layer Security
    TLSv1.2 Record Layer: Application Data Protocol: http-over-tls
        Content Type: Application Data (23)
        Version: TLS 1.2 (0x0303)
        Length: 59
        Encrypted Application Data: 000000000000018c6e51f0fb62382158704af5312c7be4d4…

0000  00 0a f3 52 9e 80 78 4f 43 50 83 ed 08 00 45 02   ...R..xOCP....E.
0010  00 68 00 00 40 00 40 06 02 8a ac 1e 02 fe 12 d3   .h..@.@.........
0020  76 15 cf 70 01 bb 1b 06 ed c6 db 46 bf 37 50 18   v..p.......F.7P.
0030  ff ff 1d f1 00 00 17 03 03 00 3b 00 00 00 00 00   ..........;.....
0040  00 01 8c 6e 51 f0 fb 62 38 21 58 70 4a f5 31 2c   ...nQ..b8!XpJ.1,
0050  7b e4 d4 c6 9d 5e 80 a1 86 1b be a6 b1 50 da 71   {....^.......P.q
0060  01 0f fc a1 59 3c e7 15 23 e5 5c 4d e0 f3 b9 70   ....Y<..#.\M...p
0070  13 ff de b7 1f 25                                 .....%

Frame 7: 54 bytes on wire (432 bits), 54 bytes captured (432 bits)
    Encapsulation type: Ethernet (1)
    Arrival Time: Dec  1, 2019 23:15:39.282552000 EST
    [Time shift for this packet: 0.000000000 seconds]
    Epoch Time: 1575260139.282552000 seconds
    [Time delta from previous captured frame: 0.002134000 seconds]
    [Time delta from previous displayed frame: 0.002134000 seconds]
    [Time since reference or first frame: 2.832909000 seconds]
    Frame Number: 7
    Frame Length: 54 bytes (432 bits)
    Capture Length: 54 bytes (432 bits)
    [Frame is marked: False]
    [Frame is ignored: False]
    [Protocols in frame: eth:ethertype:ip:tcp]
Ethernet II, Src: Cisco_52:9e:80 (00:0a:f3:52:9e:80), Dst: Apple_50:83:ed (78:4f:43:50:83:ed)
    Destination: Apple_50:83:ed (78:4f:43:50:83:ed)
        Address: Apple_50:83:ed (78:4f:43:50:83:ed)
        .... ..0. .... .... .... .... = LG bit: Globally unique address (factory default)
        .... ...0 .... .... .... .... = IG bit: Individual address (unicast)
    Source: Cisco_52:9e:80 (00:0a:f3:52:9e:80)
        Address: Cisco_52:9e:80 (00:0a:f3:52:9e:80)
        .... ..0. .... .... .... .... = LG bit: Globally unique address (factory default)
        .... ...0 .... .... .... .... = IG bit: Individual address (unicast)
    Type: IPv4 (0x0800)
Internet Protocol Version 4, Src: 18.211.118.21, Dst: 172.30.2.254
    0100 .... = Version: 4
    .... 0101 = Header Length: 20 bytes (5)
    Differentiated Services Field: 0x00 (DSCP: CS0, ECN: Not-ECT)
        0000 00.. = Differentiated Services Codepoint: Default (0)
        .... ..00 = Explicit Congestion Notification: Not ECN-Capable Transport (0)
    Total Length: 40
    Identification: 0x2468 (9320)
    Flags: 0x4000, Don't fragment
        0... .... .... .... = Reserved bit: Not set
        .1.. .... .... .... = Don't fragment: Set
        ..0. .... .... .... = More fragments: Not set
        ...0 0000 0000 0000 = Fragment offset: 0
    Time to live: 61
    Protocol: TCP (6)
    Header checksum: 0xe163 [validation disabled]
    [Header checksum status: Unverified]
    Source: 18.211.118.21
    Destination: 172.30.2.254
Transmission Control Protocol, Src Port: 443, Dst Port: 53104, Seq: 1, Ack: 65, Len: 0
    Source Port: 443
    Destination Port: 53104
    [Stream index: 1]
    [TCP Segment Len: 0]
    Sequence number: 1    (relative sequence number)
    [Next sequence number: 1    (relative sequence number)]
    Acknowledgment number: 65    (relative ack number)
    0101 .... = Header Length: 20 bytes (5)
    Flags: 0x010 (ACK)
        000. .... .... = Reserved: Not set
        ...0 .... .... = Nonce: Not set
        .... 0... .... = Congestion Window Reduced (CWR): Not set
        .... .0.. .... = ECN-Echo: Not set
        .... ..0. .... = Urgent: Not set
        .... ...1 .... = Acknowledgment: Set
        .... .... 0... = Push: Not set
        .... .... .0.. = Reset: Not set
        .... .... ..0. = Syn: Not set
        .... .... ...0 = Fin: Not set
        [TCP Flags: ·······A····]
    Window size value: 20440
    [Calculated window size: 20440]
    [Window size scaling factor: -1 (unknown)]
    Checksum: 0xb340 [unverified]
    [Checksum Status: Unverified]
    Urgent pointer: 0
    [SEQ/ACK analysis]
        [This is an ACK to the segment in frame: 6]
        [The RTT to ACK the segment was: 0.002134000 seconds]
    [Timestamps]
        [Time since first frame in this TCP stream: 0.002134000 seconds]
        [Time since previous frame in this TCP stream: 0.002134000 seconds]

0000  78 4f 43 50 83 ed 00 0a f3 52 9e 80 08 00 45 00   xOCP.....R....E.
0010  00 28 24 68 40 00 3d 06 e1 63 12 d3 76 15 ac 1e   .($h@.=..c..v...
0020  02 fe 01 bb cf 70 db 46 bf 37 1b 06 ee 06 50 10   .....p.F.7....P.
0030  4f d8 b3 40 00 00                                 O..@..

Frame 8: 118 bytes on wire (944 bits), 118 bytes captured (944 bits)
    Encapsulation type: Ethernet (1)
    Arrival Time: Dec  1, 2019 23:15:39.326427000 EST
    [Time shift for this packet: 0.000000000 seconds]
    Epoch Time: 1575260139.326427000 seconds
    [Time delta from previous captured frame: 0.043875000 seconds]
    [Time delta from previous displayed frame: 0.043875000 seconds]
    [Time since reference or first frame: 2.876784000 seconds]
    Frame Number: 8
    Frame Length: 118 bytes (944 bits)
    Capture Length: 118 bytes (944 bits)
    [Frame is marked: False]
    [Frame is ignored: False]
    [Protocols in frame: eth:ethertype:ip:tcp:tls]
Ethernet II, Src: Cisco_52:9e:80 (00:0a:f3:52:9e:80), Dst: Apple_50:83:ed (78:4f:43:50:83:ed)
    Destination: Apple_50:83:ed (78:4f:43:50:83:ed)
        Address: Apple_50:83:ed (78:4f:43:50:83:ed)
        .... ..0. .... .... .... .... = LG bit: Globally unique address (factory default)
        .... ...0 .... .... .... .... = IG bit: Individual address (unicast)
    Source: Cisco_52:9e:80 (00:0a:f3:52:9e:80)
        Address: Cisco_52:9e:80 (00:0a:f3:52:9e:80)
        .... ..0. .... .... .... .... = LG bit: Globally unique address (factory default)
        .... ...0 .... .... .... .... = IG bit: Individual address (unicast)
    Type: IPv4 (0x0800)
Internet Protocol Version 4, Src: 18.211.118.21, Dst: 172.30.2.254
    0100 .... = Version: 4
    .... 0101 = Header Length: 20 bytes (5)
    Differentiated Services Field: 0x02 (DSCP: CS0, ECN: ECT(0))
        0000 00.. = Differentiated Services Codepoint: Default (0)
        .... ..10 = Explicit Congestion Notification: ECN-Capable Transport codepoint '10' (2)
    Total Length: 104
    Identification: 0x2469 (9321)
    Flags: 0x4000, Don't fragment
        0... .... .... .... = Reserved bit: Not set
        .1.. .... .... .... = Don't fragment: Set
        ..0. .... .... .... = More fragments: Not set
        ...0 0000 0000 0000 = Fragment offset: 0
    Time to live: 61
    Protocol: TCP (6)
    Header checksum: 0xe120 [validation disabled]
    [Header checksum status: Unverified]
    Source: 18.211.118.21
    Destination: 172.30.2.254
Transmission Control Protocol, Src Port: 443, Dst Port: 53104, Seq: 1, Ack: 65, Len: 64
    Source Port: 443
    Destination Port: 53104
    [Stream index: 1]
    [TCP Segment Len: 64]
    Sequence number: 1    (relative sequence number)
    [Next sequence number: 65    (relative sequence number)]
    Acknowledgment number: 65    (relative ack number)
    0101 .... = Header Length: 20 bytes (5)
    Flags: 0x018 (PSH, ACK)
        000. .... .... = Reserved: Not set
        ...0 .... .... = Nonce: Not set
        .... 0... .... = Congestion Window Reduced (CWR): Not set
        .... .0.. .... = ECN-Echo: Not set
        .... ..0. .... = Urgent: Not set
        .... ...1 .... = Acknowledgment: Set
        .... .... 1... = Push: Set
        .... .... .0.. = Reset: Not set
        .... .... ..0. = Syn: Not set
        .... .... ...0 = Fin: Not set
        [TCP Flags: ·······AP···]
    Window size value: 20440
    [Calculated window size: 20440]
    [Window size scaling factor: -1 (unknown)]
    Checksum: 0x5ec3 [unverified]
    [Checksum Status: Unverified]
    Urgent pointer: 0
    [SEQ/ACK analysis]
        [Bytes in flight: 64]
        [Bytes sent since last PSH flag: 64]
    [Timestamps]
        [Time since first frame in this TCP stream: 0.046009000 seconds]
        [Time since previous frame in this TCP stream: 0.043875000 seconds]
    TCP payload (64 bytes)
Transport Layer Security
    TLSv1.2 Record Layer: Application Data Protocol: http-over-tls
        Content Type: Application Data (23)
        Version: TLS 1.2 (0x0303)
        Length: 59
        Encrypted Application Data: b48ee25341156b14cce8d6771266b95df7583404ae405207…

0000  78 4f 43 50 83 ed 00 0a f3 52 9e 80 08 00 45 02   xOCP.....R....E.
0010  00 68 24 69 40 00 3d 06 e1 20 12 d3 76 15 ac 1e   .h$i@.=.. ..v...
0020  02 fe 01 bb cf 70 db 46 bf 37 1b 06 ee 06 50 18   .....p.F.7....P.
0030  4f d8 5e c3 00 00 17 03 03 00 3b b4 8e e2 53 41   O.^.......;...SA
0040  15 6b 14 cc e8 d6 77 12 66 b9 5d f7 58 34 04 ae   .k....w.f.].X4..
0050  40 52 07 c9 1a 42 10 30 60 d8 b2 ae 07 37 06 50   @R...B.0`....7.P
0060  39 cd 0b 65 e1 5f 1f e0 65 d2 83 01 a9 92 f0 05   9..e._..e.......
0070  17 71 b7 34 45 86                                 .q.4E.

Frame 9: 54 bytes on wire (432 bits), 54 bytes captured (432 bits)
    Encapsulation type: Ethernet (1)
    Arrival Time: Dec  1, 2019 23:15:39.326493000 EST
    [Time shift for this packet: 0.000000000 seconds]
    Epoch Time: 1575260139.326493000 seconds
    [Time delta from previous captured frame: 0.000066000 seconds]
    [Time delta from previous displayed frame: 0.000066000 seconds]
    [Time since reference or first frame: 2.876850000 seconds]
    Frame Number: 9
    Frame Length: 54 bytes (432 bits)
    Capture Length: 54 bytes (432 bits)
    [Frame is marked: False]
    [Frame is ignored: False]
    [Protocols in frame: eth:ethertype:ip:tcp]
Ethernet II, Src: Apple_50:83:ed (78:4f:43:50:83:ed), Dst: Cisco_52:9e:80 (00:0a:f3:52:9e:80)
    Destination: Cisco_52:9e:80 (00:0a:f3:52:9e:80)
        Address: Cisco_52:9e:80 (00:0a:f3:52:9e:80)
        .... ..0. .... .... .... .... = LG bit: Globally unique address (factory default)
        .... ...0 .... .... .... .... = IG bit: Individual address (unicast)
    Source: Apple_50:83:ed (78:4f:43:50:83:ed)
        Address: Apple_50:83:ed (78:4f:43:50:83:ed)
        .... ..0. .... .... .... .... = LG bit: Globally unique address (factory default)
        .... ...0 .... .... .... .... = IG bit: Individual address (unicast)
    Type: IPv4 (0x0800)
Internet Protocol Version 4, Src: 172.30.2.254, Dst: 18.211.118.21
    0100 .... = Version: 4
    .... 0101 = Header Length: 20 bytes (5)
    Differentiated Services Field: 0x00 (DSCP: CS0, ECN: Not-ECT)
        0000 00.. = Differentiated Services Codepoint: Default (0)
        .... ..00 = Explicit Congestion Notification: Not ECN-Capable Transport (0)
    Total Length: 40
    Identification: 0x0000 (0)
    Flags: 0x4000, Don't fragment
        0... .... .... .... = Reserved bit: Not set
        .1.. .... .... .... = Don't fragment: Set
        ..0. .... .... .... = More fragments: Not set
        ...0 0000 0000 0000 = Fragment offset: 0
    Time to live: 64
    Protocol: TCP (6)
    Header checksum: 0x02cc [validation disabled]
    [Header checksum status: Unverified]
    Source: 172.30.2.254
    Destination: 18.211.118.21
Transmission Control Protocol, Src Port: 53104, Dst Port: 443, Seq: 65, Ack: 65, Len: 0
    Source Port: 53104
    Destination Port: 443
    [Stream index: 1]
    [TCP Segment Len: 0]
    Sequence number: 65    (relative sequence number)
    [Next sequence number: 65    (relative sequence number)]
    Acknowledgment number: 65    (relative ack number)
    0101 .... = Header Length: 20 bytes (5)
    Flags: 0x010 (ACK)
        000. .... .... = Reserved: Not set
        ...0 .... .... = Nonce: Not set
        .... 0... .... = Congestion Window Reduced (CWR): Not set
        .... .0.. .... = ECN-Echo: Not set
        .... ..0. .... = Urgent: Not set
        .... ...1 .... = Acknowledgment: Set
        .... .... 0... = Push: Not set
        .... .... .0.. = Reset: Not set
        .... .... ..0. = Syn: Not set
        .... .... ...0 = Fin: Not set
        [TCP Flags: ·······A····]
    Window size value: 65535
    [Calculated window size: 65535]
    [Window size scaling factor: -1 (unknown)]
    Checksum: 0x02d9 [unverified]
    [Checksum Status: Unverified]
    Urgent pointer: 0
    [SEQ/ACK analysis]
        [This is an ACK to the segment in frame: 8]
        [The RTT to ACK the segment was: 0.000066000 seconds]
    [Timestamps]
        [Time since first frame in this TCP stream: 0.046075000 seconds]
        [Time since previous frame in this TCP stream: 0.000066000 seconds]

0000  00 0a f3 52 9e 80 78 4f 43 50 83 ed 08 00 45 00   ...R..xOCP....E.
0010  00 28 00 00 40 00 40 06 02 cc ac 1e 02 fe 12 d3   .(..@.@.........
0020  76 15 cf 70 01 bb 1b 06 ee 06 db 46 bf 77 50 10   v..p.......F.wP.
0030  ff ff 02 d9 00 00                                 ......

Frame 10: 93 bytes on wire (744 bits), 93 bytes captured (744 bits)
    Encapsulation type: Ethernet (1)
    Arrival Time: Dec  1, 2019 23:15:39.815909000 EST
    [Time shift for this packet: 0.000000000 seconds]
    Epoch Time: 1575260139.815909000 seconds
    [Time delta from previous captured frame: 0.489416000 seconds]
    [Time delta from previous displayed frame: 0.489416000 seconds]
    [Time since reference or first frame: 3.366266000 seconds]
    Frame Number: 10
    Frame Length: 93 bytes (744 bits)
    Capture Length: 93 bytes (744 bits)
    [Frame is marked: False]
    [Frame is ignored: False]
    [Protocols in frame: eth:ethertype:ip:tcp:tls]
Ethernet II, Src: Apple_50:83:ed (78:4f:43:50:83:ed), Dst: Cisco_52:9e:80 (00:0a:f3:52:9e:80)
    Destination: Cisco_52:9e:80 (00:0a:f3:52:9e:80)
        Address: Cisco_52:9e:80 (00:0a:f3:52:9e:80)
        .... ..0. .... .... .... .... = LG bit: Globally unique address (factory default)
        .... ...0 .... .... .... .... = IG bit: Individual address (unicast)
    Source: Apple_50:83:ed (78:4f:43:50:83:ed)
        Address: Apple_50:83:ed (78:4f:43:50:83:ed)
        .... ..0. .... .... .... .... = LG bit: Globally unique address (factory default)
        .... ...0 .... .... .... .... = IG bit: Individual address (unicast)
    Type: IPv4 (0x0800)
Internet Protocol Version 4, Src: 172.30.2.254, Dst: 172.217.13.206
    0100 .... = Version: 4
    .... 0101 = Header Length: 20 bytes (5)
    Differentiated Services Field: 0x02 (DSCP: CS0, ECN: ECT(0))
        0000 00.. = Differentiated Services Codepoint: Default (0)
        .... ..10 = Explicit Congestion Notification: ECN-Capable Transport codepoint '10' (2)
    Total Length: 79
    Identification: 0x0000 (0)
    Flags: 0x4000, Don't fragment
        0... .... .... .... = Reserved bit: Not set
        .1.. .... .... .... = Don't fragment: Set
        ..0. .... .... .... = More fragments: Not set
        ...0 0000 0000 0000 = Fragment offset: 0
    Time to live: 64
    Protocol: TCP (6)
    Header checksum: 0xd0e3 [validation disabled]
    [Header checksum status: Unverified]
    Source: 172.30.2.254
    Destination: 172.217.13.206
Transmission Control Protocol, Src Port: 63732, Dst Port: 443, Seq: 1, Ack: 1, Len: 39
    Source Port: 63732
    Destination Port: 443
    [Stream index: 2]
    [TCP Segment Len: 39]
    Sequence number: 1    (relative sequence number)
    [Next sequence number: 40    (relative sequence number)]
    Acknowledgment number: 1    (relative ack number)
    0101 .... = Header Length: 20 bytes (5)
    Flags: 0x018 (PSH, ACK)
        000. .... .... = Reserved: Not set
        ...0 .... .... = Nonce: Not set
        .... 0... .... = Congestion Window Reduced (CWR): Not set
        .... .0.. .... = ECN-Echo: Not set
        .... ..0. .... = Urgent: Not set
        .... ...1 .... = Acknowledgment: Set
        .... .... 1... = Push: Set
        .... .... .0.. = Reset: Not set
        .... .... ..0. = Syn: Not set
        .... .... ...0 = Fin: Not set
        [TCP Flags: ·······AP···]
